book_id,book_name,author_id,author_name,publishing_company,city
6236810226505,Meet key week get professional number experience.,037805825,Alisha Mcgee,Edwards Inc,Robertbury
9239762848877,Ball entire hotel top.,037805825,Alisha Mcgee,Edwards Inc,Robertbury
3710477794094,Third discuss choose condition.,037805825,Alisha Mcgee,Edwards Inc,Robertbury
7388571441228,East knowledge coach collection including what.,037805825,Alisha Mcgee,Edwards Inc,Robertbury
4248352839138,Toward decide lead.,037805825,Alisha Mcgee,Edwards Inc,Robertbury
4173310097988,Check beat nice yard state accept.,037805825,Alisha Mcgee,Edwards Inc,Robertbury
2503632661383,West age notice likely rock right.,048830740,John Salinas MD,Bond Group,East Robert
4996478302721,These easy analysis daughter organization mother.,048830740,John Salinas MD,Bond Group,East Robert
8127273194075,A second reflect election.,088807186,Crystal Lopez,Bond Group,Antonioburgh
2133195817448,Recognize best appear maybe.,088807186,Crystal Lopez,Bond Group,Antonioburgh
3206627381769,Network require we parent.,053295118,Jerome Weiss,Contreras and Sons,Antonioburgh
9324725081269,Camera part laugh production.,053295118,Jerome Weiss,Contreras and Sons,Antonioburgh
2991571025678,Reflect behavior another project tend writer.,053295118,Jerome Weiss,Contreras and Sons,Antonioburgh
3452514401762,Affect hit fire foreign kid board.,053295118,Jerome Weiss,Contreras and Sons,Antonioburgh
5086574214444,Reflect safe find rather poor.,053295118,Jerome Weiss,Contreras and Sons,Antonioburgh
0589629234039,Trip lose avoid necessary be.,108892660,Brian Hardy,Bond Group,Antonioburgh
0852212818726,Building difference media treatment.,055414573,Emily Garcia,Glenn Inc,Antonioburgh
9215457999994,Drug chair certainly section.,055414573,Emily Garcia,Glenn Inc,Antonioburgh
3202554207509,Film fall where pull more beautiful.,055414573,Emily Garcia,Glenn Inc,Antonioburgh
6887192007376,Would approach send.,037702656,Barbara Tanner,Bond Group,Antonioburgh
2217384572896,Tend involve let.,070808520,Lisa Hill,Romero Ltd,Port Anthonyhaven
5938561124277,Risk stop culture receive option cultural.,070808520,Lisa Hill,Romero Ltd,Port Anthonyhaven
7353426173807,Beautiful son window.,070808520,Lisa Hill,Romero Ltd,Port Anthonyhaven
1705406590764,Type quite name sit.,070808520,Lisa Hill,Romero Ltd,Port Anthonyhaven
8937583771084,Series throw foot visit add.,070808520,Lisa Hill,Romero Ltd,Port Anthonyhaven
8237735084773,School present population analysis.,110007485,Deborah Barry,Carter-Lee,Port Anthonyhaven
3222991720386,Open example partner inside like company.,014279830,Brian Coleman,Hart LLC,Robertbury
3041297173760,Practice character Democrat.,014279830,Brian Coleman,Hart LLC,Robertbury
6648717816749,Detail hundred stock seat.,014279830,Brian Coleman,Hart LLC,Robertbury
6160089800367,Book good woman.,014279830,Brian Coleman,Hart LLC,Robertbury
7018126769636,Drive road whether lay else many put.,014279830,Brian Coleman,Hart LLC,Robertbury
6863552141560,She mention run enjoy.,014279830,Brian Coleman,Hart LLC,Robertbury
9409009671456,Under address star voice old.,014279830,Brian Coleman,Hart LLC,Robertbury
6876623462716,Improve development or.,014279830,Brian Coleman,Hart LLC,Robertbury
6221187130388,Exactly issue newspaper society.,014279830,Brian Coleman,Hart LLC,Robertbury
6360678608842,Near difference reveal doctor economic be.,014279830,Brian Coleman,Hart LLC,Robertbury
5788412588600,Can most create any station.,014279830,Brian Coleman,Hart LLC,Robertbury
2667241617282,Air add concern.,014279830,Brian Coleman,Hart LLC,Robertbury
4030066979190,Heavy loss identify fund hand your.,014279830,Brian Coleman,Hart LLC,Robertbury
9008181877368,Training above writer prevent create.,014279830,Brian Coleman,Hart LLC,Robertbury
9389990067752,Carry stop memory.,014279830,Brian Coleman,Hart LLC,Robertbury
9130705796081,Fire kitchen move win.,014279830,Brian Coleman,Hart LLC,Robertbury
3705182421137,Although house majority candidate create cultural.,014279830,Brian Coleman,Hart LLC,Robertbury
9420177908397,Game game happy medical bank security.,014279830,Brian Coleman,Hart LLC,Robertbury
1303210524397,Central country bed matter look.,014279830,Brian Coleman,Hart LLC,Robertbury
4066144969173,Far concern whose left.,014279830,Brian Coleman,Hart LLC,Robertbury
8843566629115,Under series new better.,014279830,Brian Coleman,Hart LLC,Robertbury
5446051489794,Hospital trouble development buy above.,014279830,Brian Coleman,Hart LLC,Robertbury
7622125928521,Statement from standard tree.,014279830,Brian Coleman,Hart LLC,Robertbury
5819530178173,Stop place middle lay relate American.,086602079,Brett Scott,Romero Ltd,Port Anthonyhaven
7390958233395,Debate guy story would figure end.,086602079,Brett Scott,Romero Ltd,Port Anthonyhaven
5255967680368,House over site meeting skin.,104343498,Natalie Davis,Glenn Inc,Antonioburgh
9287464833738,Reflect something choice book.,104343498,Natalie Davis,Glenn Inc,Antonioburgh
3448285176794,Speak nice both wrong leader stage.,104343498,Natalie Davis,Glenn Inc,Antonioburgh
7422780243720,Any meet western or idea.,129673295,David Shah,Torres-Camacho,Port Anthonyhaven
2156763147853,This citizen as occur recent as.,129673295,David Shah,Torres-Camacho,Port Anthonyhaven
7166771554265,Trouble animal civil area few always.,129673295,David Shah,Torres-Camacho,Port Anthonyhaven
0112088627304,Say floor happy.,061473375,Stephen Kirk,Contreras and Sons,Antonioburgh
5034170481456,News offer dream clear mean inside.,061473375,Stephen Kirk,Contreras and Sons,Antonioburgh
4778565081319,Evening first lead skin offer.,061473375,Stephen Kirk,Contreras and Sons,Antonioburgh
2411732335441,Foreign employee front hot hard.,061473375,Stephen Kirk,Contreras and Sons,Antonioburgh
7994332531284,International service energy big.,061473375,Stephen Kirk,Contreras and Sons,Antonioburgh
1814977797721,Eat yeah set body radio.,112956194,Andrew Pierce,Diaz and Sons,East Robert
5719073277114,Win represent newspaper heavy dinner.,112956194,Andrew Pierce,Diaz and Sons,East Robert
9215900586986,Right daughter away lose.,112956194,Andrew Pierce,Diaz and Sons,East Robert
2721875817835,Those may very education.,128287556,Daniel Galloway,Bond Group,East Robert
4418949202816,Site left we population.,128287556,Daniel Galloway,Bond Group,East Robert
9221111187089,Forget affect year concern.,128287556,Daniel Galloway,Bond Group,East Robert
0033244945363,But which not him.,109419194,Amanda Hoffman,Glenn Inc,Antonioburgh
0602785282444,Should hour own other city room.,104914788,Victoria Garza,Edwards Inc,Antonioburgh
2904716103926,Support trial give wide voice.,104914788,Victoria Garza,Edwards Inc,Antonioburgh
7263384791251,Team commercial she.,085084368,Bryan Jensen,Glenn Inc,Robertbury
5299563442784,Raise avoid land system.,085084368,Bryan Jensen,Glenn Inc,Robertbury
2186537467979,Successful summer for north green.,085084368,Bryan Jensen,Glenn Inc,Robertbury
4157225977894,Anything technology large stuff vote wish.,085084368,Bryan Jensen,Glenn Inc,Robertbury
5406124552268,Tend bank result.,085084368,Bryan Jensen,Glenn Inc,Robertbury
2681042691777,Quickly factor but policy late.,012219148,Lisa Taylor,Bond Group,Antonioburgh
3211131529347,Bag trip speak attention his red lay.,012219148,Lisa Taylor,Bond Group,Antonioburgh
0563653911456,Letter few boy against international at.,012219148,Lisa Taylor,Bond Group,Antonioburgh
0393727123108,Until power student side where grow.,012219148,Lisa Taylor,Bond Group,Antonioburgh
6420361007281,During project water hour.,098572540,Darren Conrad,Bond Group,East Robert
4764696985107,Table ground close institution form style.,098572540,Darren Conrad,Bond Group,East Robert
8306788872610,Deal authority grow.,104425387,Melissa Williams,Bond Group,Antonioburgh
3455818438427,War above major ahead contain.,104425387,Melissa Williams,Bond Group,Antonioburgh
6877997468878,Amount space money American agree.,104425387,Melissa Williams,Bond Group,Antonioburgh
0848475055503,Try buy how.,104425387,Melissa Williams,Bond Group,Antonioburgh
7808142837972,People debate enough military have.,018954313,Lauren Olson,"Pratt, Schmitt and Smith",New Tonya
9113507354093,Cold five song.,073682824,Christopher Perez,Bond Group,East Robert
0905922626928,Usually fine course myself them.,073682824,Christopher Perez,Bond Group,East Robert
6076909180895,Example opportunity political away well.,073682824,Christopher Perez,Bond Group,East Robert
3754506460192,Exactly quite resource million value.,045496925,Robert Smith,Sullivan Inc,Antonioburgh
9345609882031,Seek reach alone dream pretty.,045496925,Robert Smith,Sullivan Inc,Antonioburgh
3468517138338,Network class owner debate.,077004521,Katie Phelps,Diaz and Sons,Robertbury
0945247232473,Owner somebody third natural.,077004521,Katie Phelps,Diaz and Sons,Robertbury
0744821889634,Physical ability true.,077004521,Katie Phelps,Diaz and Sons,Robertbury
1521541420601,Paper size give continue environmental bag.,077004521,Katie Phelps,Diaz and Sons,Robertbury
5675423547361,Face fly radio firm TV.,077004521,Katie Phelps,Diaz and Sons,Robertbury
9647410833098,Open leave share.,077004521,Katie Phelps,Diaz and Sons,Robertbury
6293158848783,Model note many manager who.,077004521,Katie Phelps,Diaz and Sons,Robertbury
4998462084644,Picture what shake fast.,077004521,Katie Phelps,Diaz and Sons,Robertbury
1444389130924,Key simple future simply buy style.,089226122,Frank Ferguson,Bond Group,Antonioburgh
4075037872155,Interview leave leader bank.,089226122,Frank Ferguson,Bond Group,Antonioburgh
2347046295464,Art growth central child attorney our.,089226122,Frank Ferguson,Bond Group,Antonioburgh
3664385215076,Imagine three hear weight tree deal.,089226122,Frank Ferguson,Bond Group,Antonioburgh
6051304283914,Manager form represent clear hear state.,089226122,Frank Ferguson,Bond Group,Antonioburgh
5099964989853,Memory include prepare.,089226122,Frank Ferguson,Bond Group,Antonioburgh
1019678119265,Hot wrong also dog baby ask.,089226122,Frank Ferguson,Bond Group,Antonioburgh
2609251640805,Media less area.,089226122,Frank Ferguson,Bond Group,Antonioburgh
4199047606507,Check figure red possible.,089226122,Frank Ferguson,Bond Group,Antonioburgh
1379778569361,Sometimes compare budget.,089226122,Frank Ferguson,Bond Group,Antonioburgh
7425435821021,More reason seem increase.,089226122,Frank Ferguson,Bond Group,Antonioburgh
2423064983016,Hard sort break hit.,089226122,Frank Ferguson,Bond Group,Antonioburgh
7703707524840,Piece compare situation kitchen power.,089226122,Frank Ferguson,Bond Group,Antonioburgh
3416975756755,Very effort share one.,069253555,Michael Vargas,Barnes Inc,Robertbury
3363494370286,Look always perhaps.,029522598,Jason Jones,"Alvarez, Gilbert and Parsons",Robertbury
4525490780493,Base here political.,029522598,Jason Jones,"Alvarez, Gilbert and Parsons",Robertbury
8010441415433,Clear type building measure effort doctor.,029522598,Jason Jones,"Alvarez, Gilbert and Parsons",Robertbury
1302059549462,Image far glass its.,029522598,Jason Jones,"Alvarez, Gilbert and Parsons",Robertbury
5417255746952,Out from camera.,029522598,Jason Jones,"Alvarez, Gilbert and Parsons",Robertbury
0773284861253,Season travel inside.,069186936,Christine Duffy,Glenn Inc,East Robert
0847741042698,Green may outside.,069186936,Christine Duffy,Glenn Inc,East Robert
7832515941942,Sign parent guess cover away know.,069186936,Christine Duffy,Glenn Inc,East Robert
6737192588545,Action finish table approach.,069186936,Christine Duffy,Glenn Inc,East Robert
3464333021960,Conference member impact growth growth paper.,069186936,Christine Duffy,Glenn Inc,East Robert
7418524565036,Player cold relate state activity store.,069186936,Christine Duffy,Glenn Inc,East Robert
8560127718292,One consider other foreign treatment administration.,069186936,Christine Duffy,Glenn Inc,East Robert
3367633323072,Process together near professional most.,069186936,Christine Duffy,Glenn Inc,East Robert
9102828469678,Sense plant second air these.,069186936,Christine Duffy,Glenn Inc,East Robert
0247938231780,Bar television perhaps say coach send.,069186936,Christine Duffy,Glenn Inc,East Robert
7232034190676,Reveal decide age find case down.,069186936,Christine Duffy,Glenn Inc,East Robert
5290435086662,Finish federal address dinner begin country.,041871926,Gabrielle Brown,Diaz and Sons,Antonioburgh
9088083351296,Region try think me.,041871926,Gabrielle Brown,Diaz and Sons,Antonioburgh
9818040789387,Tend wish simply.,041871926,Gabrielle Brown,Diaz and Sons,Antonioburgh
8805334579428,Parent again fire administration democratic color.,041871926,Gabrielle Brown,Diaz and Sons,Antonioburgh
1925728147938,Same ready very large better reflect.,029688869,Jenna Wilkins,Shannon-Diaz,Antonioburgh
5962440888493,Hundred scientist day within.,029688869,Jenna Wilkins,Shannon-Diaz,Antonioburgh
4056586957845,Season star so onto.,065655937,Tammy Hughes,Carter-Lee,Antonioburgh
0349723361976,Decade third economy cost stock culture.,015199236,Angel Silva,Scott Inc,East Robert
7805948394326,Compare southern billion onto.,071737865,Timothy Lopez,Edwards Inc,Robertbury
0646911470367,Purpose can spring trouble my box.,016668575,April King,Torres-Camacho,Antonioburgh
1259639073148,Soon one itself.,016668575,April King,Torres-Camacho,Antonioburgh
7636091580935,And rise then model.,016668575,April King,Torres-Camacho,Antonioburgh
6243645911667,Capital area order senior.,016668575,April King,Torres-Camacho,Antonioburgh
8471491560625,Image opportunity attention stuff follow store.,016668575,April King,Torres-Camacho,Antonioburgh
3084540754408,Any position let that.,016668575,April King,Torres-Camacho,Antonioburgh
0081207027403,Learn culture night partner form meet.,016668575,April King,Torres-Camacho,Antonioburgh
3367928731797,Hold son morning.,099601290,Matthew Montoya,Bond Group,East Robert
6595084251218,Tend speak while.,099601290,Matthew Montoya,Bond Group,East Robert
6550426412702,Fact per country identify run century.,099601290,Matthew Montoya,Bond Group,East Robert
3882148748443,Relationship drug since science turn improve.,029785843,Jordan Stark,Glenn Inc,Robertbury
3017430795588,Drop church lose view identify.,029785843,Jordan Stark,Glenn Inc,Robertbury
7239390083123,Meet economic along stuff book building.,029785843,Jordan Stark,Glenn Inc,Robertbury
8368854342601,Week change system.,029785843,Jordan Stark,Glenn Inc,Robertbury
1284426062043,Yourself great various man.,029785843,Jordan Stark,Glenn Inc,Robertbury
1099641555443,Stay speech price.,029785843,Jordan Stark,Glenn Inc,Robertbury
8175507287765,Inside machine off.,029785843,Jordan Stark,Glenn Inc,Robertbury
4284864360128,Hear traditional law key thought.,029785843,Jordan Stark,Glenn Inc,Robertbury
0030573981826,Size travel decide house.,105657866,William Warren,Bond Group,East Amyton
9972844714836,Worry beautiful four.,057084998,Gregory Vaughan,Bond Group,East Amyton
3033874252043,Property maintain poor early phone able.,095718378,Jennifer Martinez,"Brooks, Chang and Johnson",Robertbury
9676344303285,Fear west measure.,095718378,Jennifer Martinez,"Brooks, Chang and Johnson",Robertbury
9454183527945,Step difficult least for.,090140857,Joel Reeves,Diaz and Sons,East Robert
2941163764782,Laugh star choice buy.,090140857,Joel Reeves,Diaz and Sons,East Robert
2554329822082,Something policy just sure industry dream.,090140857,Joel Reeves,Diaz and Sons,East Robert
7143437371497,Traditional news staff side.,018548758,Crystal Roberts,Anderson-Frey,Port Anthonyhaven
0882037075585,Although central single chair they consider.,018548758,Crystal Roberts,Anderson-Frey,Port Anthonyhaven
0312564373859,Beyond build threat model bar.,018548758,Crystal Roberts,Anderson-Frey,Port Anthonyhaven
0540257528495,Focus low past yes represent.,018548758,Crystal Roberts,Anderson-Frey,Port Anthonyhaven
3544152935003,Expect road home news early.,018548758,Crystal Roberts,Anderson-Frey,Port Anthonyhaven
2667791496825,Such nor wind these science.,018548758,Crystal Roberts,Anderson-Frey,Port Anthonyhaven
3144263239214,Often campaign use.,018548758,Crystal Roberts,Anderson-Frey,Port Anthonyhaven
4526022158988,Decision according onto.,067584598,Paul Sloan,"Pratt, Schmitt and Smith",Robertbury
9082097510946,Service sister organization commercial quite.,067584598,Paul Sloan,"Pratt, Schmitt and Smith",Robertbury
4774597849934,Unit thus trouble situation already heavy.,067584598,Paul Sloan,"Pratt, Schmitt and Smith",Robertbury
0522992550993,Between me most someone rather various.,067584598,Paul Sloan,"Pratt, Schmitt and Smith",Robertbury
7462323953846,Stop third reduce usually.,053603551,Ernest Vargas,Sullivan Inc,East Amyton
6169533965430,Indeed hour charge less good candidate effect.,053603551,Ernest Vargas,Sullivan Inc,East Amyton
0346201806622,Information buy explain.,049057810,Robert Smith,Edwards Inc,Robertbury
3302431038094,Economy main city act.,103110415,Cameron Mueller,Romero Ltd,Port Anthonyhaven
4236675612125,Beautiful front moment TV glass.,103110415,Cameron Mueller,Romero Ltd,Port Anthonyhaven
7747041877279,When baby Congress.,103110415,Cameron Mueller,Romero Ltd,Port Anthonyhaven
8596876721078,Computer officer system staff.,103110415,Cameron Mueller,Romero Ltd,Port Anthonyhaven
8892519050049,Measure admit because.,103110415,Cameron Mueller,Romero Ltd,Port Anthonyhaven
7124254934270,Debate guy wonder.,103110415,Cameron Mueller,Romero Ltd,Port Anthonyhaven
1931257357052,Last during top others every almost.,103110415,Cameron Mueller,Romero Ltd,Port Anthonyhaven
3101461455426,Present later letter take glass.,103110415,Cameron Mueller,Romero Ltd,Port Anthonyhaven
7092102972906,Yet family start cup loss clear.,103110415,Cameron Mueller,Romero Ltd,Port Anthonyhaven
4641520316637,Tell because by set activity.,021468029,Ruth Franklin,Anderson-Frey,Port Anthonyhaven
0161530178062,Everyone blood record yet.,040343688,Erik Morris,Romero Ltd,Port Anthonyhaven
1403855972024,Fire administration forget quickly.,040343688,Erik Morris,Romero Ltd,Port Anthonyhaven
1682049305347,Young production policy head.,084297664,Dawn Ortiz,Anderson-Frey,Port Anthonyhaven
1791158125057,Attorney TV white alone be culture.,084297664,Dawn Ortiz,Anderson-Frey,Port Anthonyhaven
5052005188806,Him itself information on lawyer.,084297664,Dawn Ortiz,Anderson-Frey,Port Anthonyhaven
8847818412814,Probably determine indicate plan discussion moment.,084297664,Dawn Ortiz,Anderson-Frey,Port Anthonyhaven
9264569560226,More pattern again say fly.,084297664,Dawn Ortiz,Anderson-Frey,Port Anthonyhaven
5418875114602,Continue city per bed.,084297664,Dawn Ortiz,Anderson-Frey,Port Anthonyhaven
4471991539866,Across reach beyond.,027865642,Mr. Frederick Salas,Bond Group,Antonioburgh
6254403300869,Herself entire by result my.,021767160,Amy Richardson,Bond Group,Antonioburgh
1807057886491,Minute group oil fine thank age.,021767160,Amy Richardson,Bond Group,Antonioburgh
7862305008029,Occur discussion place.,021767160,Amy Richardson,Bond Group,Antonioburgh
1013543792966,Follow clearly along reality.,021767160,Amy Richardson,Bond Group,Antonioburgh
6767084840918,Century another wind must.,021767160,Amy Richardson,Bond Group,Antonioburgh
6169573590876,Outside case nor.,021767160,Amy Richardson,Bond Group,Antonioburgh
8927277000002,Pick above if support if party.,113593491,Sandra Phillips,Romero Ltd,Port Anthonyhaven
1953836646166,Civil just door.,061646021,Brandon Sanchez,"Pratt, Schmitt and Smith",East Robert
7720871758147,Source begin sea American structure story.,096122743,Michelle Nelson,Contreras and Sons,East Amyton
4492266096228,Fear attorney there walk.,020315649,Ashley Fuentes,Bond Group,Antonioburgh
3507817595448,South stock like hotel party.,079370363,Summer Monroe,Torres-Camacho,Antonioburgh
4042937626447,Too clearly such.,079370363,Summer Monroe,Torres-Camacho,Antonioburgh
5392316776591,Shoulder attention decision.,048358086,Anthony Pena,Romero Ltd,Antonioburgh
2065725495942,Thought response keep.,052290062,Randy Luna,Romero Ltd,Port Anthonyhaven
7875189040108,Level home report.,052290062,Randy Luna,Romero Ltd,Port Anthonyhaven
3554839901504,Painting today movement across.,052290062,Randy Luna,Romero Ltd,Port Anthonyhaven
0733358586710,Program speak miss.,052290062,Randy Luna,Romero Ltd,Port Anthonyhaven
3835647423007,Face third national.,052290062,Randy Luna,Romero Ltd,Port Anthonyhaven
1964891529196,Simply father parent discover opportunity staff.,052290062,Randy Luna,Romero Ltd,Port Anthonyhaven
9492743201096,Indeed finish large when voice.,052290062,Randy Luna,Romero Ltd,Port Anthonyhaven
9294404242741,Relate here term soldier who.,052290062,Randy Luna,Romero Ltd,Port Anthonyhaven
5458156401830,Term best for too south.,052290062,Randy Luna,Romero Ltd,Port Anthonyhaven
1402566195708,Feeling administration serve all.,052290062,Randy Luna,Romero Ltd,Port Anthonyhaven
7948204266996,Shoulder beat morning cultural factor.,052290062,Randy Luna,Romero Ltd,Port Anthonyhaven
2075265504509,Some she hour station fish determine.,052290062,Randy Luna,Romero Ltd,Port Anthonyhaven
8221197533382,These great set.,052290062,Randy Luna,Romero Ltd,Port Anthonyhaven
7077743946189,Drop particular painting.,060387284,Amy Gonzalez,Edwards Inc,Antonioburgh
2616287668123,Capital risk sure long.,019317205,Kyle George,Glenn Inc,Antonioburgh
0774571981197,Senior war away market need.,019317205,Kyle George,Glenn Inc,Antonioburgh
7453059544842,American station standard.,019317205,Kyle George,Glenn Inc,Antonioburgh
7429427468737,Think ok true seven left carry.,019317205,Kyle George,Glenn Inc,Antonioburgh
7869115363669,Message surface prevent.,019317205,Kyle George,Glenn Inc,Antonioburgh
3873088769896,Morning state collection.,019317205,Kyle George,Glenn Inc,Antonioburgh
8965014266991,Up everybody quite among.,027876822,Robert Carter,Edwards Inc,Port Anthonyhaven
5454271590237,Somebody decision scene.,027876822,Robert Carter,Edwards Inc,Port Anthonyhaven
5328064568836,Us year garden surface book anything.,027876822,Robert Carter,Edwards Inc,Port Anthonyhaven
8080496134887,Room her sit.,027876822,Robert Carter,Edwards Inc,Port Anthonyhaven
2343312653754,Oil million father.,027876822,Robert Carter,Edwards Inc,Port Anthonyhaven
5997119292264,Always unit national couple.,027876822,Robert Carter,Edwards Inc,Port Anthonyhaven
1307977715708,Detail create teach think deep plant.,027876822,Robert Carter,Edwards Inc,Port Anthonyhaven
0133683658821,Certain life buy series.,027876822,Robert Carter,Edwards Inc,Port Anthonyhaven
6817282781138,Avoid trial leader ago.,027876822,Robert Carter,Edwards Inc,Port Anthonyhaven
3439218966582,Send good trial lead alone.,027876822,Robert Carter,Edwards Inc,Port Anthonyhaven
8408780109968,Best nature goal some sort keep.,027876822,Robert Carter,Edwards Inc,Port Anthonyhaven
1537303389895,Increase though wrong half.,027876822,Robert Carter,Edwards Inc,Port Anthonyhaven
5040339151733,Town once woman.,050151051,Jeffrey Duncan,Bond Group,East Robert
1058824719584,Major director practice source involve.,050151051,Jeffrey Duncan,Bond Group,East Robert
0693246561383,Drive same for education successful.,097541734,Jacob Griffin,Bond Group,East Amyton
3258689583681,I never assume more.,037238706,Luis Wall,Romero Ltd,Antonioburgh
2304975147615,Impact memory small.,122846919,Mrs. Katherine Anderson,Edwards Inc,Antonioburgh
0422150774639,Economy try marriage adult per.,108333899,Cindy Foley,Bond Group,Robertbury
8654819328231,Spring even fill increase.,108333899,Cindy Foley,Bond Group,Robertbury
2968962714305,Field bar office.,038356399,Jacob Joseph,Diaz and Sons,Robertbury
2857415930242,Performance piece issue finally us.,042526869,Christopher Horne,Barnes Inc,Robertbury
4056812448086,Believe nature say realize economic.,018644982,Jeffery Howard,Hart LLC,Robertbury
7620510809707,Together in hit.,018644982,Jeffery Howard,Hart LLC,Robertbury
9267976869173,Something base manage past might adult.,018644982,Jeffery Howard,Hart LLC,Robertbury
9316171631570,To hold wind good follow fill.,110300506,Janet Morse,Bond Group,Antonioburgh
8771136236244,Card door mother.,110300506,Janet Morse,Bond Group,Antonioburgh
3516157704113,Should end fish.,052418310,Albert Fox,Bond Group,New Tonya
8233162089343,Rise hope hotel election.,050195428,Andrew Smith,Bond Group,East Robert
6754061518427,Common dog letter stop computer.,050195428,Andrew Smith,Bond Group,East Robert
6602761697556,Rather realize cell inside democratic act.,128965933,Mary Knapp,Contreras and Sons,East Robert
4729260630203,Information worker management brother.,074974816,Alexander Hayes,Hart LLC,Port Anthonyhaven
5920984711325,So top that.,074974816,Alexander Hayes,Hart LLC,Port Anthonyhaven
8933834586209,Nature some safe.,074974816,Alexander Hayes,Hart LLC,Port Anthonyhaven
7520667950997,Television thought than allow.,074974816,Alexander Hayes,Hart LLC,Port Anthonyhaven
8167288762623,Material appear treatment somebody.,074974816,Alexander Hayes,Hart LLC,Port Anthonyhaven
5739843300101,Four son test identify continue.,074974816,Alexander Hayes,Hart LLC,Port Anthonyhaven
0370750754516,Up challenge ten world support.,074974816,Alexander Hayes,Hart LLC,Port Anthonyhaven
1780592768036,Cold floor wear wrong.,109178930,Rachel Villarreal,Contreras and Sons,Robertbury
8457782580930,These paper identify.,010883453,Gregory Newman,"Brooks, Chang and Johnson",Robertbury
2148601539005,Manager can anything business.,010883453,Gregory Newman,"Brooks, Chang and Johnson",Robertbury
6394885305812,Interesting brother physical series.,010883453,Gregory Newman,"Brooks, Chang and Johnson",Robertbury
6642196508836,Test east character join room explain.,010883453,Gregory Newman,"Brooks, Chang and Johnson",Robertbury
6584220557277,Apply financial coach.,121712824,Charles Gonzales,Edwards Inc,Antonioburgh
2412100426457,Ground vote close apply laugh.,121712824,Charles Gonzales,Edwards Inc,Antonioburgh
8596383388986,Represent television page.,121712824,Charles Gonzales,Edwards Inc,Antonioburgh
