book_id,book_name,author_id,author_name,publishing_company,city
1216354142788,Tax feeling involve with.,121712824,Charles Gonzales,Edwards Inc,Antonioburgh
0999767002672,Environment check few significant fly.,121712824,Charles Gonzales,Edwards Inc,Antonioburgh
9481780245187,Then third central main chair form.,121712824,Charles Gonzales,Edwards Inc,Antonioburgh
6257741470577,Why environmental notice teacher program still million.,121712824,Charles Gonzales,Edwards Inc,Antonioburgh
3687777441204,While imagine item wife anything fly.,121712824,Charles Gonzales,Edwards Inc,Antonioburgh
8768319511465,Mr once traditional without administration interest.,121712824,Charles Gonzales,Edwards Inc,Antonioburgh
6122390355929,Consider so certainly.,121712824,Charles Gonzales,Edwards Inc,Antonioburgh
1863124645880,Citizen world radio.,121712824,Charles Gonzales,Edwards Inc,Antonioburgh
8890702915625,Heavy floor rule.,084449247,Adam Smith,Contreras and Sons,Antonioburgh
8520622698871,Where shake final natural than still.,084449247,Adam Smith,Contreras and Sons,Antonioburgh
1981750259889,Chair treatment although west much.,084449247,Adam Smith,Contreras and Sons,Antonioburgh
9600076818908,Management perhaps area generation certain.,017540799,Latasha Myers,Torres-Camacho,East Amyton
6208686021935,Behind manager brother.,017540799,Latasha Myers,Torres-Camacho,East Amyton
6166475700259,National feeling computer walk letter tell continue.,029376896,Robert Jones,Diaz and Sons,New Tonya
5503523220290,I against day often my.,029376896,Robert Jones,Diaz and Sons,New Tonya
6983738097181,Activity writer investment evidence security.,088282963,Craig Villarreal,Anderson-Frey,East Amyton
8168482048353,Season good professional raise claim.,088282963,Craig Villarreal,Anderson-Frey,East Amyton
4612126101675,Truth question board.,088282963,Craig Villarreal,Anderson-Frey,East Amyton
5847654630703,Budget represent continue.,088282963,Craig Villarreal,Anderson-Frey,East Amyton
1110117329242,Finish within heavy behavior.,088282963,Craig Villarreal,Anderson-Frey,East Amyton
4281246497472,Several boy group less.,011226857,Deborah Banks,Edwards Inc,Robertbury
6611494634974,By even media myself.,011226857,Deborah Banks,Edwards Inc,Robertbury
7149097715398,Speak water which building rise.,011226857,Deborah Banks,Edwards Inc,Robertbury
0646398449955,Amount less own expect.,011226857,Deborah Banks,Edwards Inc,Robertbury
1666434276429,Affect fight general wrong bit sure.,011226857,Deborah Banks,Edwards Inc,Robertbury
8803476498669,From light seek doctor.,011226857,Deborah Banks,Edwards Inc,Robertbury
4863548059406,Her man much over company deep make.,011226857,Deborah Banks,Edwards Inc,Robertbury
3099390157033,Experience next to arrive we majority.,011226857,Deborah Banks,Edwards Inc,Robertbury
6644742575262,Kind later tend future cultural try.,011226857,Deborah Banks,Edwards Inc,Robertbury
0780886821349,Too economic create.,011226857,Deborah Banks,Edwards Inc,Robertbury
6032144098319,Manage stock relationship every.,011226857,Deborah Banks,Edwards Inc,Robertbury
2729764982510,Television myself each outside.,011226857,Deborah Banks,Edwards Inc,Robertbury
5029370312365,Threat face seven eye it actually.,011226857,Deborah Banks,Edwards Inc,Robertbury
7844632040866,Floor issue their impact bad.,011226857,Deborah Banks,Edwards Inc,Robertbury
4650786332695,Structure two thus generation foot enter.,011226857,Deborah Banks,Edwards Inc,Robertbury
4517340772604,Dog than show career.,011226857,Deborah Banks,Edwards Inc,Robertbury
1906024049027,Write west answer.,011226857,Deborah Banks,Edwards Inc,Robertbury
6409056566715,Cultural pick by.,011226857,Deborah Banks,Edwards Inc,Robertbury
6983707207610,Cup say fly smile such person.,011226857,Deborah Banks,Edwards Inc,Robertbury
0044468800277,Mother still Republican ball military response.,011226857,Deborah Banks,Edwards Inc,Robertbury
9045785506515,Treatment program enter boy.,011226857,Deborah Banks,Edwards Inc,Robertbury
4938603970870,Million relate month field.,011226857,Deborah Banks,Edwards Inc,Robertbury
3482891346899,Glass field stage employee.,011226857,Deborah Banks,Edwards Inc,Robertbury
5772743292299,Business build party manage serious.,011226857,Deborah Banks,Edwards Inc,Robertbury
3808558466890,Brother father identify.,011226857,Deborah Banks,Edwards Inc,Robertbury
9606901623334,Send from southern magazine difficult clear.,011226857,Deborah Banks,Edwards Inc,Robertbury
6319175345354,Forward social word knowledge out.,011226857,Deborah Banks,Edwards Inc,Robertbury
6271276893069,Toward law offer.,011226857,Deborah Banks,Edwards Inc,Robertbury
2039677270605,Fast meet Congress check.,011226857,Deborah Banks,Edwards Inc,Robertbury
0198979772681,Kind visit short.,011226857,Deborah Banks,Edwards Inc,Robertbury
4375328975399,State enough last as.,011226857,Deborah Banks,Edwards Inc,Robertbury
3707321294619,However factor picture ground do.,011226857,Deborah Banks,Edwards Inc,Robertbury
6096507515998,Into system side plant.,011226857,Deborah Banks,Edwards Inc,Robertbury
0588689325930,Open nearly offer policy dinner large.,011226857,Deborah Banks,Edwards Inc,Robertbury
5946167183239,Safe still bank right start.,011226857,Deborah Banks,Edwards Inc,Robertbury
2375552110711,Edge soldier character.,011226857,Deborah Banks,Edwards Inc,Robertbury
7564871528283,Me small produce beyond suffer.,011226857,Deborah Banks,Edwards Inc,Robertbury
9860870432681,Less number fly nothing.,125979427,Melanie May,Edwards Inc,New Tonya
4201281915106,Sing area western.,097959863,Carl Fox,Contreras and Sons,East Amyton
4588636349091,Brother first high against.,097959863,Carl Fox,Contreras and Sons,East Amyton
8642751265721,Door indeed treat peace when.,039087641,Chad Garcia,Romero Ltd,Antonioburgh
3986428362340,Could concern cold.,027593040,Alan Bennett,Glenn Inc,Robertbury
3149526063643,Feeling his meet reason reflect reduce.,027593040,Alan Bennett,Glenn Inc,Robertbury
7126903682457,Into player help.,059878911,Jessica Thompson,"Kelley, Harvey and Jordan",Port Anthonyhaven
0753229708560,Ever practice suffer ground then heavy.,059878911,Jessica Thompson,"Kelley, Harvey and Jordan",Port Anthonyhaven
7467386782761,Others pull region degree hold.,059878911,Jessica Thompson,"Kelley, Harvey and Jordan",Port Anthonyhaven
0454609719823,Often customer many realize bed.,059878911,Jessica Thompson,"Kelley, Harvey and Jordan",Port Anthonyhaven
8679944751495,You use director law.,020649755,Scott Craig,Bond Group,Robertbury
6346347399754,Article bank final key.,110981297,Alexander Jackson,Bond Group,East Amyton
9141584632254,Because store degree drop participant.,077009458,Elizabeth Craig,Glenn Inc,Robertbury
4250655343939,Upon research hard staff total and.,060230975,Valerie Cooke,Contreras and Sons,New Tonya
3789823818494,Reach foot south easy.,060230975,Valerie Cooke,Contreras and Sons,New Tonya
2073751393354,Consider late industry.,060230975,Valerie Cooke,Contreras and Sons,New Tonya
5796129130715,Happen until authority similar him table.,060230975,Valerie Cooke,Contreras and Sons,New Tonya
6946259339475,Peace green and single far send.,060230975,Valerie Cooke,Contreras and Sons,New Tonya
4985741436133,Mouth compare approach life trade.,096039483,Timothy Gordon,Bond Group,East Robert
8317477365634,Tell argue much young provide century.,096039483,Timothy Gordon,Bond Group,East Robert
8847098224541,The despite opportunity.,096039483,Timothy Gordon,Bond Group,East Robert
6734751994182,Truth future line eye view recent.,038624432,Audrey Boyle,Contreras and Sons,East Robert
7151430553635,Idea long expect.,103238724,Paul Hartman,Bond Group,Antonioburgh
1632567230126,Bank dinner series.,093406187,Yvonne Lambert,Glenn Inc,Antonioburgh
6581815522801,Program strategy go.,093406187,Yvonne Lambert,Glenn Inc,Antonioburgh
7634135313525,Central tree bank general thought.,093406187,Yvonne Lambert,Glenn Inc,Antonioburgh
2787461646661,Third ball forward.,025845347,Adrian Stevens,Contreras and Sons,Antonioburgh
0475006756761,Design later on concern.,025845347,Adrian Stevens,Contreras and Sons,Antonioburgh
7234626641078,Occur television traditional with.,028876559,Sylvia Roberts,Bond Group,Robertbury
2705594113676,These if change report film.,028876559,Sylvia Roberts,Bond Group,Robertbury
2666189304599,Must property final.,028876559,Sylvia Roberts,Bond Group,Robertbury
0488305235240,More gas positive old mean.,028876559,Sylvia Roberts,Bond Group,Robertbury
9075389899522,Third run half travel eye age.,119418020,Alicia Cooper,Shannon-Diaz,Robertbury
6608936674056,Provide picture make travel parent pattern.,119418020,Alicia Cooper,Shannon-Diaz,Robertbury
6204373254013,Center if may plant control push.,119418020,Alicia Cooper,Shannon-Diaz,Robertbury
0824038620470,End fall rise away center feel.,119418020,Alicia Cooper,Shannon-Diaz,Robertbury
3016097916435,General special television involve professor like.,119418020,Alicia Cooper,Shannon-Diaz,Robertbury
5432911242388,Indicate wide away cold see.,119418020,Alicia Cooper,Shannon-Diaz,Robertbury
6994986151310,Piece activity loss man thought opportunity.,119418020,Alicia Cooper,Shannon-Diaz,Robertbury
5765969383469,Rather low whether out.,072118959,John Spencer,Barnes Inc,Robertbury
3198955943354,Build story wife life media end.,091412050,Hannah Cordova,Bond Group,East Robert
5007470510195,Stay home middle people per truth.,078729931,Katherine Edwards,Bond Group,East Robert
0623914720750,Represent enough area eat.,078729931,Katherine Edwards,Bond Group,East Robert
6155553577920,Section note rather.,078729931,Katherine Edwards,Bond Group,East Robert
6460908380958,Particularly offer ready put.,078729931,Katherine Edwards,Bond Group,East Robert
8578931874813,Model community expert student.,078729931,Katherine Edwards,Bond Group,East Robert
1584659216115,Trial stop citizen.,120645277,Ashley Fisher,Edwards Inc,Robertbury
5591379379552,Accept particularly hair federal.,120645277,Ashley Fisher,Edwards Inc,Robertbury
5811236395755,Field minute attack accept system religious.,120645277,Ashley Fisher,Edwards Inc,Robertbury
3233458970084,Each gas all street analysis ready.,120645277,Ashley Fisher,Edwards Inc,Robertbury
8093684908214,Hospital consider four animal.,120645277,Ashley Fisher,Edwards Inc,Robertbury
4159028824290,Reflect his book.,085404472,Charles Hopkins,Contreras and Sons,Antonioburgh
7356250765446,Improve explain build once yet wide.,085404472,Charles Hopkins,Contreras and Sons,Antonioburgh
3763614708782,Collection join create check relationship.,085404472,Charles Hopkins,Contreras and Sons,Antonioburgh
8278194973031,Per discussion other claim.,085404472,Charles Hopkins,Contreras and Sons,Antonioburgh
4102546185978,To sell either send answer.,085404472,Charles Hopkins,Contreras and Sons,Antonioburgh
9268841439118,Really car white.,085404472,Charles Hopkins,Contreras and Sons,Antonioburgh
4744852577810,See position outside describe.,085404472,Charles Hopkins,Contreras and Sons,Antonioburgh
9335150323428,Represent stuff future.,085404472,Charles Hopkins,Contreras and Sons,Antonioburgh
4248367864644,Community behavior local.,085404472,Charles Hopkins,Contreras and Sons,Antonioburgh
6161873880855,Laugh statement box agency.,068592589,Marcus Larsen,Glenn Inc,Port Anthonyhaven
1054191005213,Live need successful ability.,068592589,Marcus Larsen,Glenn Inc,Port Anthonyhaven
3165427572039,Sign establish while population.,015178422,Daniel Meza,"Peterson, Taylor and Rivera",East Robert
7519825217454,Central above know military kitchen on.,032027695,Kristina Kim,Barnes Inc,Port Anthonyhaven
9950053011564,Several political myself agency.,032027695,Kristina Kim,Barnes Inc,Port Anthonyhaven
9755604866422,Bill shoulder indicate ten decade.,032027695,Kristina Kim,Barnes Inc,Port Anthonyhaven
1469497583783,Your ball man safe create.,032027695,Kristina Kim,Barnes Inc,Port Anthonyhaven
1701411780152,Worker our hear.,032027695,Kristina Kim,Barnes Inc,Port Anthonyhaven
9114783941441,Catch thank outside establish.,032027695,Kristina Kim,Barnes Inc,Port Anthonyhaven
1098344402054,Respond perhaps candidate.,032027695,Kristina Kim,Barnes Inc,Port Anthonyhaven
9658035127967,Popular buy continue true.,032027695,Kristina Kim,Barnes Inc,Port Anthonyhaven
6601245196714,He full meeting service would.,032027695,Kristina Kim,Barnes Inc,Port Anthonyhaven
8121706868373,Pay big person.,032027695,Kristina Kim,Barnes Inc,Port Anthonyhaven
0675081392070,Someone someone result should employee.,032027695,Kristina Kim,Barnes Inc,Port Anthonyhaven
8607428201020,Few experience population alone.,032027695,Kristina Kim,Barnes Inc,Port Anthonyhaven
2476943955727,Throughout hit everything.,032027695,Kristina Kim,Barnes Inc,Port Anthonyhaven
7416396217022,Conference goal look.,032027695,Kristina Kim,Barnes Inc,Port Anthonyhaven
2393965086850,Idea life room.,032027695,Kristina Kim,Barnes Inc,Port Anthonyhaven
7066895503364,Step soldier strategy.,032027695,Kristina Kim,Barnes Inc,Port Anthonyhaven
0490157113539,Difficult night nature police necessary bad.,032027695,Kristina Kim,Barnes Inc,Port Anthonyhaven
3321739907772,International civil computer air.,032027695,Kristina Kim,Barnes Inc,Port Anthonyhaven
8268995622344,Evening miss with resource natural determine.,032027695,Kristina Kim,Barnes Inc,Port Anthonyhaven
8219749035491,Station work surface thing.,032027695,Kristina Kim,Barnes Inc,Port Anthonyhaven
3149090950073,Agency spend society.,032027695,Kristina Kim,Barnes Inc,Port Anthonyhaven
2006581885836,Down son address lot reach eight.,040855367,Louis White,Shannon-Diaz,Robertbury
4755813199248,Until reason parent Mr both over.,040855367,Louis White,Shannon-Diaz,Robertbury
0773830650430,According campaign take rather.,040855367,Louis White,Shannon-Diaz,Robertbury
7916856131290,To subject under push.,040855367,Louis White,Shannon-Diaz,Robertbury
3390999370916,Region management small.,040855367,Louis White,Shannon-Diaz,Robertbury
0722114142734,Structure reality operation around according education.,113960985,Vincent Cooper,Hart LLC,Robertbury
6255933825112,Language specific beat friend respond interview.,113960985,Vincent Cooper,Hart LLC,Robertbury
7195913635371,Help write have allow hot reach.,113960985,Vincent Cooper,Hart LLC,Robertbury
3161083574837,Not serious debate take pass employee.,113960985,Vincent Cooper,Hart LLC,Robertbury
2308560216489,Stuff free man.,113960985,Vincent Cooper,Hart LLC,Robertbury
0144423659336,Road player doctor pull.,113960985,Vincent Cooper,Hart LLC,Robertbury
7571643146712,Answer establish knowledge real cover.,113960985,Vincent Cooper,Hart LLC,Robertbury
3050256778472,In more evening top.,113960985,Vincent Cooper,Hart LLC,Robertbury
7934137005023,Democrat event fine respond.,113960985,Vincent Cooper,Hart LLC,Robertbury
2745789845012,Measure despite thus real management small.,113960985,Vincent Cooper,Hart LLC,Robertbury
8356394513056,Service section too he reason walk.,113960985,Vincent Cooper,Hart LLC,Robertbury
6156695090735,Which yet school person east.,113960985,Vincent Cooper,Hart LLC,Robertbury
1230738357131,Collection speech enjoy serve media.,113960985,Vincent Cooper,Hart LLC,Robertbury
1548400851697,Join cold nothing population condition.,085320527,Megan Harrington,"Dixon, Erickson and George",East Brendastad
